Запросы со словами;Число запросов;Топ частотных запросов «впн скачать на айфон», 19.04.2026 — 19.05.2026, все регионы, все устройствавпн скачать на айфон;76129;скачать впн на айфон бесплатно;42071;какой впн скачать на айфон;6409;скачать впн на айфон на русском;5872;скачать впн бесплатно на айфон 2026;4496;впн скачать бесплатно айфон на русском языке;2401;скачать впн на айфон без регистрации;2294;скачать впн бесплатный без регистрации на айфон;2276;ваня впн скачать на айфон;2268;впн дядя ваня скачать на айфон;2215;какой впн скачать на айфон бесплатно;2194;скачать работающий впн на айфон;2015;скачать хороший впн на айфон;1629;скачать впн для телеграмма на айфон;1451;огонь впн скачать на айфон;1210;впн скачать бесплатно для айфон на русском;1205;какой скачать впн на айфон чтобы работал;1085;впн для телеграмма бесплатно скачать на айфон;1081;джамп джамп впн скачать на айфон;1080;скачать хороший впн на айфон бесплатно;1019;скачать впн jump jump на айфон;994;какой впн можно скачать на айфон;981;амнезия впн скачать на айфон;817;скачать платный впн на айфон;784;скачать впн на телефон айфон;749;скачать ключ впн на айфон;718;скачать впн для тик тока на айфон;706;как скачать впн на айфон без;672;скачать впн на айфон без ключа;671;скачать впн jump бесплатно на айфон;662;впн скачать бесплатно на телефон айфон;640;огонь впн скачать бесплатно на айфон;639;как скачать дед впн на айфон;636;vpn впн скачать на айфон;626;впн бесплатный скачать на айфон чтобы работал;622;скачать впн россия на айфон;605;какой впн лучше скачать на айфон;594;можно ли скачать впн на айфон;581;скачать рабочий впн на айфон;571;впн без ключа бесплатно на айфон скачать;563;скачать happ впн на айфон;551;бебра впн скачать на айфон;513;скачать бебру впн на айфон;513;vpn впн скачать бесплатно на айфон;504;тик впн бесплатно скачать на айфон;476;планет впн скачать на айфон;441;скачать впн на айфон топ;412;скачать супер впн на айфон;410;впн прокси скачать на айфон;401;как скачать впн на айфон в 2026;396;впн джамп скачать бесплатно на айфон;379;впн на айфон скачать апстор;367;телеграмм без впн скачать на айфон;358;скачать приложение впн на айфон;321;тип топ впн скачать на айфон;321;какой бесплатный впн можно скачать на айфон;310;скачать хапп впн на айфон;307;скачать рабочий впн на айфон бесплатно;304;где скачать впн на айфон;302;батя впн скачать на айфон;297;скачать впн v2raytun на айфон;293;скачать впн для тг на айфон;289;дядя ваня впн скачать бесплатно на айфон;273;скачать впн на айфон 11;268;скачать впн для инстаграмма на айфон;259;fkey впн скачать на айфон;257;планет впн скачать бесплатно на айфон;256;впн скачать бесплатно на айфон для инстаграмма;255;инстаграм впн скачать на айфон;251;скачать впн для роблокс на айфон;245;какой лучше скачать впн на айфон бесплатно;240;впн byebyedpi скачать на айфон;235;апп стор впн на айфон скачать;228;какаду впн скачать на айфон;226;впн про скачать на айфон;220;впн дед скачать бесплатно на айфон;204;скачать впн для ютуба на айфон;200;флай впн скачать на айфон;198;тип топ впн скачать на айфон бесплатно;197;какой скачать впн на айфон для телеграмма;197;скачать тик ток без впн на айфон;192;скачать впн мод на айфон;189;какой впн скачать на айфон бесплатно 2026;187;как скачать впн на айфон инструкция;184;скачать впн для тг бесплатно на айфон;184;скачать впн f3 на айфон;181;супер впн скачать бесплатно на айфон;170;bye bye впн скачать на айфон;167;впн bye dpi скачать на айфон;160;какой впн скачать на айфон в 2026;160;скачать аво впн на айфон;155;фкей впн скачать на айфон;155;скачать впн хап на айфон;151;скачать телега впн на айфон;150;впн наружу скачать на айфон;149;щука впн скачать на айфон;149;как скачать хит впн на айфон;149;бай бай впн скачать на айфон;148;впн скачать на айфон ап стор;146;скачать макс впн на айфон;145;скачать впн на айфон 2025;145;скачать впн для тт на айфон;141;скачать бесплатный впн на айфон для инстаграма;136;скачать впн для бравла на айфон;136;скачать впн v2 на айфон;135;впн для ютуба на айфон бесплатно скачать;131;джум джум впн скачать на айфон;129;скачать впн на айфон без телеграм;129;скачать впн для бравл старс на айфон;128;скачать впн на айфон без апп стор;126;скачать впн олень на айфон;124;скачать впн happ plus на айфон;123;бравл впн скачать на айфоне как;122;скачать впн на айфон аппстор;122;впн скачать на айфон app store;119;скачать лагом впн на айфон;118;дед прокси впн скачать на айфон;116;скачать впн мастер на айфон;114;как скачать впн на новый айфон;114;впн скачать бесплатно на айфон 2025;112;юбуст впн скачать на айфон;112;скачать впн f3 бесплатно на айфон;111;скачать телегу без впн на айфон;107;впн прокси скачать бесплатно на айфон;107;протон впн скачать на айфон;106;какой впн скачать на айфон 11;105;скачать впн на айфон 12;104;как скачать адгуард впн на айфон;103;сплит впн скачать на айфон;102;скачать впн для телеграм на айфон;101;скачать впн для телеграма на айфон;101;какой впн скачать для роблокса на айфон;99;hitproxy впн скачать на айфон;97;скачать супер впн с оленем на айфон;97;дедуля впн скачать на айфон;96;скачать впн на айфон без рекламы;96;какой впн скачать на айфон без ключа;95;впн для роблокса бесплатно скачать на айфон;95;впн bucks скачать на айфон;95;скачать впн buck на айфон;95;впн скачать бесплатно на айфон батя;94;какой впн надо скачать на айфон;90;скачать в2 впн на айфон;88;скачать приложение впн бесплатно на айфон;88;пипл впн скачать на айфон;87;пуля впн скачать на айфон;87;скачать впн на айфон через браузер;87;скачать бравл без впн на айфон;86;какой рабочий впн скачать на айфон;85;скачать впн для россии бесплатно на айфон;84;дурев впн скачать на айфон;84;какой впн скачать на айфон платный;84;впн ф3 скачать на айфон;83;впн мастер скачать на айфон бесплатно;82;скачать впн adguard на айфон;80;скачать впн byebyedpi бесплатно на айфон;80;хитрей впн скачать на айфон;79;какой впн скачать на айфон 7;79;почему не скачать впн на айфон;77;хороший впн на айфон бесплатно 2026 скачать;76;впн прокси мастер скачать на айфон;75;какой хороший впн можно скачать на айфон;74;какой впн сейчас скачать на айфон;74;скачать впн buck super на айфон;73;скачать нормальный впн на айфон;73;где скачать бесплатный впн на айфон;72;скачать впн авокадо на айфон;72;скачать впн на айфон отзывы;70;инстаграм без впн на айфон скачать;70;впн хаб скачать на айфон;69;как скачать впн на айфон 17;69;скачать впн на айфон для ватсап;69;скачать впн бай бай дипиай на айфон;67;хит впн скачать бесплатно на айфон;65;скачать впн про бесплатно на айфон;65;скачать впн на айфон 13 бесплатно;64;впн скачать бесплатно на айфон телеграм;64;как скачать впн на айфон 13;64;самый лучший впн на айфон скачать;64;скачать фаст впн на айфон;63;скачать впн бесплатно на айфон без телеграмма;63;сплит впн скачать бесплатно на айфон;62;какой впн нужно скачивать на айфон;62;скачать впн портал вг на айфон;62;скачать впн на айфон 14;61;турбо впн скачать на айфон;60;впн мир скачать на айфон;59;впн для ватсапа скачать бесплатно на айфон;59;впн скачать бесплатно на айфон happ;59;скачать впн на айфон онлайн;58;скачать впн hitray на айфон;57;скачать впн на айфон 10;56;как можно скачать впн на айфон;56;впн прокси мастер скачать бесплатно на айфон;56;скачать хит прокси впн на айфон;56;скачать сота впн на айфон;56;скачать спид топ впн на айфон;55;скачать впн на айфон 16 бесплатно;55;впн fkey скачать бесплатно на айфон;54;как скачать впн на айфон 16;54;бай бай впн скачать бесплатно на айфон;53;впн флай скачать бесплатно на айфон;53;скачать впн на айфон файлом;52;как скачать впн на 6 айфон;52;впн для тт на айфон бесплатно скачать;52;какой впн скачать на айфон без телеграмма;51;какой впн скачать на айфон 17;51;скачать впн джам джам на айфон;51;как скачать впн на айфон 7;50;вулкан впн скачать на айфон;48;бомж впн скачать на айфон;48;как скачать и установить впн на айфон;48;протон впн скачать бесплатно на айфон;47;не получается скачать впн на айфон;47;скачать впн на айфон 16 про;46;скачать пробный впн на айфон;46;какой впн скачать на айфон 13;44;скачать впн на айфон 15 бесплатно;44;скачать впн на айфон ipa;44;скачать фри впн на айфон;44;скачать впн на 7 айфон бесплатно;44;впн скачать бесплатно на айфон app store;44;скачать конфигурацию впн на айфон;43;аво впн скачать бесплатно на айфон;43;скачать коваленко впн на айфон;43;нарр впн скачать на айфон;42;впн на айфон бесплатно скачать ап стор;42;скачать быстрый впн на айфон;41;скачать впн на айфон браво;41;впн cat скачать на айфон;41;впн олень скачать бесплатно на айфон;41;турбо впн скачать бесплатно на айфон;40;как скачать впн на айфон 15;40;где можно скачать впн на айфон;40;фкей впн скачать бесплатно на айфон;40;впн для айфона скачать на андроид;40;скачать впн бесплатно на айфон 17;39;как скачать впн на айфон без апстора;39;впн bay bay dpi скачать на айфон;38;люмен впн скачать на айфон;38;какой впн скачать для тт на айфон;37;скачать безопасный впн на айфон;37;какое приложение впн скачать на айфон;37;лагом впн скачать бесплатно на айфон;37;какой впн скачать на айфон 15;36;какой впн скачать на новый айфон;36;скачать гусь впн на айфон;36;скачать роблокс без впн на айфон;36;скачать впн на айфон апл стор;36;byebyedpl впн скачать на айфон;36;бланк впн скачать на айфон;36;супер впн флай скачать на айфон;36;скачать впн на айфон бесплатно без аппстора;35;какой впн скачать для телеграм на айфон;35;скачать ютуб без впн на айфон;35;впн скачать бесплатно на айфон онлайн;35;какой впн скачать на айфон отзывы;35;скачать впн buck super 2026 на айфон;35;впн adguard скачать бесплатно на айфон;34;впн для игр на айфон скачать;34;впн buck скачать бесплатно на айфон;34;впн bucks скачать бесплатно на айфон;34;какой впн скачать на айфон 6;34;почему не получается скачать впн на айфон;34;скачать простой впн на айфон;34;скачать впн огонек на айфон;34;скачать тт без впн на айфон;34;скачать впн через телеграм на айфон;34;скачать опен впн на айфон;33;впн цветок на айфон скачать;33;скачать впн обход глушилок на айфон;33;впн белка на айфон скачать;33;фаст впн скачать бесплатно на айфон;32;скачать впн speedtop на айфон;32;скачать впн для интернета на айфон;32;скачать впн на айфон 16 про макс;31;какой впн можно скачать на айфон 11;31;можно ли скачать впн на айфон 7;31;скачать днс впн на айфон;31;какой впн скачать на айфон 16;30;впн щука скачать бесплатно на айфон;30;как скачать впн на айфон 5;30;бесплатный впн на айфон 2026 апрель скачать;29;как скачать впн на старый айфон;29;впн кэт скачать на айфон;29;дуров впн скачать на айфон;29;какой впн можно скачать на айфон 7;29;скачать буе буе впн на айфон;28;бич впн скачать на айфон;28;впн фри скачать бесплатно на айфон;28;скачать впн speed top на айфон;28;молния впн скачать на айфон;28;впн амнезия скачать бесплатно на айфон;28;pipl впн скачать на айфон;27;какой впн скачать на айфон 12;27;скачать впн на айфон fast;27;фри впн фаст скачать на айфон;27;скачать мощный впн на айфон;27;как скачать впн без интернета на айфон;27;скачать впн v2 на айфон бесплатно;27;нот впн на айфон бесплатно скачать;27;как скачать дел впн на айфон;27;скачать взлом впн на айфон;27;скачать тикток на айфон без впн;27;почему нельзя скачать впн на айфон;26;скачать впн hiddify на айфон;26;впн cat скачать бесплатно на айфон;26;яндекс впн скачать бесплатно на айфон;25;как сейчас скачать впн на айфон;25;хитпрокси впн скачать на айфон;25;какой впн скачать на айфон 8;25;какой впн скачать на айфон 11 бесплатно;25;скачать впн с браузера на айфон;24;как скачать впн на айфон без тг;24;как скачать впн на айфон 8;23;какой скачать впн в апсторе на айфон;23;впн скачать бесплатно на айфон отзывы;23;какой впн скачать на телефон айфон;23;скачать впн медведь на айфон;23;как скачать впн на айфон 11 бесплатно;22;впн белка на айфон бесплатно скачать;22;хиро впн скачать на айфон;22;впн скачать бесплатно на айфон ссылки;22;платный впн на айфон самый лучший скачать;22;как скачать впн на айфон 17 про;21;скачать впн на айфон бесплатно через браузер;21;скачать впн бай бай дпи на айфон;21;какие впн можно скачать на айфон 6;21;адгуард впн скачать бесплатно на айфон;21;впн скачать на айфон 2026 тг;21;какой впн скачать на айфон сегодня;21;изи впн скачать на айфон;20;какой впн скачать на айфон 14;20;псифон впн скачать бесплатно на айфон;20;скачать премиум впн на айфон;20;впн кэт скачать бесплатно на айфон;19;скачать впн самсунг на айфон;19;впн buck super скачать бесплатно на айфон;19;скачать впн антиглушилка на айфон;19;скачать впн byedpi на айфон;19;скачать впн на айфон 12 бесплатно;19;byebyedpl впн скачать бесплатно на айфон;18;какой нормальный впн скачать на айфон;18;сервер для впн на айфон скачать;18;v2raytun впн скачать бесплатно на айфон;18;джам джамп впн скачать на айфон;18;скачать новый впн бесплатно на айфон;18;впн скачать бесплатно на айфон 8;18;как скачать мори впн на айфон;17;фри впн фаст скачать бесплатно на айфон;17;скачать впн птичка на айфон;17;скачать впн лайт на айфон;17;скачать впн через тг на айфон;17;скачать впн в2райтун на айфон;17;герой впн скачать на айфон;17;плато впн скачать на айфон;17;бесплатный впн на айфон скачать в апстор;17;гусь впн скачать бесплатно на айфон;17;скачать впн на айфон программу;16;впн скачать бесплатно на айфон телега;16;впн мир скачать бесплатно на айфон;16;скачать супер впн 2026 на айфон;16;скачать бесплатный быстрый впн на айфон;16;как скачать впн на айфон через яндекс;16;скачать впн browsec на айфон;16;папер впн скачать на айфон;16;скачать адгард впн на айфон;15;впн сша скачать на айфон;15;можно ли скачать впн fkey на айфон;15;лагон впн скачать на айфон;15;какой впн скачать на айфон форум;15;впн с обходом заглушек скачать на айфон;15;скачать впн на айфон через пк;15;какой впн можно скачать на айфон 5;15;нужно ли скачивать впн на айфон;15;впн бобер скачать на айфон;15;можно скачать впн happ на айфон;14;какой впн скачать на айфон 10;14;как скачать впн через телеграмм на айфон;14;как скачать впн на айфон без аппстора;14;как скачать впн в 2 на айфон;14;скачать впн portal wg на айфон;14;впн скачать бесплатно на айфон хап;14;где скачать рабочий впн на айфон;14;скачать буст впн на айфон;14;хапп плюс впн скачать на айфон;14;planet впн скачать на айфон;14;jamp впн на айфон скачать;13;скачать впн red shield на айфон;13;как скачать нот впн на айфон;13;люмен впн скачать бесплатно на айфон;13;ф кей впн скачать на айфон;13;норм впн на айфон скачать;13;впн скачать бесплатно на айфон для интернета;13;скачать впн lagom на айфон;12;какой впн можно скачать на айфон se;12;пуля впн скачать бесплатно на айфон;12;радмин впн скачать на айфон;12;эфкей впн скачать на айфон;11;корги впн скачать на айфон;11;ультима впн скачать на айфон;11;откуда скачать впн на айфон;11;скачать впн v2 raytun на айфон;11;мем впн скачать на айфон;11;скачать впн на айфон 6s;11;скачать whale впн на айфон;11;дет впн скачать на айфон;11;пипл впн скачать бесплатно на айфон;11;ульта впн скачать на айфон;11;какой впн можно скачать на айфон отзывы;11;скачать впн 1.1 1.1 на айфон;10;скачать впн adguard vpn бесплатно на айфон;10;hitwave впн скачать на айфон;10;авокадо впн скачать бесплатно на айфон;10;