скачать впн на айфон через вк;10;как скачать дядя впн на айфон инструкция;10;скачать впн outline на айфон;10;впн скачать бесплатно на айфон джамп джумп;10;на 12 айфоне можно скачать впн;10;скачать впн бесплатно на айфон старый;10;октохайд впн скачать на айфон;10;byebye впн скачать на айфон;10;российский впн скачать на айфон;10;скачать впн типтоп на айфон;9;скачать сафари впн на айфон;9;впн скачать бесплатно на айфон форум;9;как скачать тикток на айфон с впн;9;супер впн флай 2026 скачать на айфон;9;как выбрать и скачать впн на айфон;9;скачать впн free vpn fast на айфон;9;windscribe впн скачать на айфон;9;зуг впн скачать на айфон;9;как скачать впн на айфон через компьютер;9;скачать впн на айфон super vpn;9;как скачать дед впн на айфон 2026;9;запрет впн скачать на айфон;9;какой впн можно скачать на айфон 5s;9;как правильно скачать впн на айфон;8;скачать впн v 2 бесплатно на айфон;8;скачать взломанный впн на айфон;8;скачать впн в2 бесплатно на айфон;8;скачать впн на айфон без конфигурации;8;скачать впн fly на айфон;8;норд впн скачать на айфон;8;телега не работает на айфон скачать впн;8;капибара впн скачать на айфон;8;скачать впн на айфон 2026 платный;8;впн streisand скачать на айфон;8;скачать впн гуард на айфон;8;впн медведь скачать бесплатно на айфон;8;каринг впн скачать на айфон;8;как скачать амнезия впн на телефон айфон;8;как скачать бесплатный впн на айфон 14;8;как скачать ред шилд впн на айфон;8;как скачать впн jumpjump на айфон;7;вебра впн скачать на айфон;7;нормальный бесплатный впн на айфон скачать;7;впн unlimited скачать на айфон;7;какой безопасный впн скачать на айфон;7;скачать впн на айфон 11 без апстора;7;скачать актуальный впн на айфон;7;скачать впн ниндзя на айфон;7;впн скачать бесплатно на айфон эпстор;7;скачать впн psiphon на айфон;7;впн с цветочком на айфон скачать;7;самсунг макс впн скачать на айфон;6;скачать впн бесплатно на айфон файлом;6;впн фокс скачать на айфон;6;как теперь скачать впн на айфон;6;как скачать впн плато про на айфон;6;2 рэй впн скачать на айфон;6;джамп ждамп впн скачать на айфон;6;скачать впн octohide на айфон;6;скачать впн для айфона на бравлс старс;6;скачать кек впн на айфон;6;впн томато скачать на айфон бесплатно;6;где скачать хороший впн на айфон;6;впн товарищ скачать на айфон;6;какой впн скачать на айфон xr;6;тип тор впн скачать на айфон;6;как скачать ситим впн на айфон;6;скорость впн скачать на айфон;5;скачать впн на айфон через сафари;5;патриот впн скачать на айфон;5;как скачать впн на айфон форум;5;как скачать хороший впн на айфон платный;5;фит прокси впн скачать на айфон;5;замена впн на айфон скачать бесплатно;5;впн букс скачать бесплатно на айфон;3;скачать впн vpnify бесплатно на айфон;3;октохайд впн скачать бесплатно на айфон;3;впн whale vpn на айфон скачать;3;скачать везарус впн на айфон;2;дед proxy впн скачать на айфон;2;